sentence,combination,root,modifier,property,human_label_majority,meta.human_labels,meta.combination_human_relevance,meta.root_human_relevance,meta.modifier_human_relevance,meta.gpt-4o_emergence,meta.combination_gpt-4o_relevance,meta.root_gpt-4o_relevance,meta.modifier_gpt-4o_relevance,meta.toxicity,meta.gpt-4o_indiv_max
"A teacher without a school, or outside a school, seems to them rather like a gunner without a gun.",a gunner without a gun,gunner,gun,unarmed,emergent,"(emergent, emergent, emergent)","(5, 5, 5)","(3, 2, 2)","(5, 5, 4)",1.0,1.0,0.0,0.0,False,0.0
"A month from now, just like the ChickFilA tempest in a teapot, no one will remember or care.",the ChickFilA tempest in a teapot,tempest,teapot,overblown,emergent,"(emergent, emergent, emergent)","(5, 5, 5)","(5, 4, 4)","(1, 3, 3)",0.2222222222222222,0.7777777777777778,0.5555555555555556,0.1111111111111111,False,0.5555555555555556
"the pain inside her matched the violence without , livid stalks of lightning stretched taut from earth to cloud , the space between streaked like burnt iron .",burnt iron,iron,burn,dark,emergent,"(component, emergent, emergent)","(4, 5, 5)","(3, 4, 2)","(3, 4, 4)",0.5555555555555556,0.8888888888888888,0.3333333333333333,0.3333333333333333,False,0.3333333333333333
doubt creeps in like a poisonous fog .,a poisonous fog,fog,poisonous,suffocate,emergent,"(emergent, emergent, emergent)","(5, 5, 4)","(3, 3, 4)","(4, 4, 4)",0.8888888888888888,0.8888888888888888,0.0,0.0,False,0.0
"Jeannette Catsoulis of The New York Times wrote that despite Hecker capturing knowing images of Florida, she criticized his antiquated screenplay for lacking freshness in its given genre and giving his cast limited caricature parts, concluding that Tilly's fiveminute cameo reminds viewers that comedy without risk is as barren as a prom without a theme.",a prom without a theme,prom,theme,lackluster,emergent,"(emergent, emergent, emergent)","(5, 5, 5)","(3, 3, 3)","(2, 3, 4)",0.3333333333333333,0.6666666666666666,0.2222222222222222,0.3333333333333333,False,0.3333333333333333
I think it's a little hyperbolic to say it's as bad as comic sans but I also see where you're coming from.,comic sans,san,comic,dislike,emergent,"(emergent, emergent, emergent)","(5, 5, 5)","(1, 1, 1)","(2, 2, 1)",0.5555555555555556,0.6666666666666666,0.0,0.1111111111111111,False,0.1111111111111111
An aeroplane in these hills will be just about as useful as a Dreadnought in a millpond.,a Dreadnought in a millpond,dreadnought,millpond,inappropriate,emergent,"(emergent, emergent, emergent)","(4, 5, 5)","(2, 2, 4)","(2, 3, 3)",0.5555555555555556,0.7777777777777778,0.2222222222222222,0.1111111111111111,False,0.2222222222222222
"Well,' ses he, 'I live in the present, the past, and the future, and though I dwell in a hut at the foot of the hills beyond, I am as happy as a cow in clover.",a cow in clover,cow,clover,happy,emergent,"(emergent, emergent, emergent)","(5, 5, 5)","(3, 2, 3)","(4, 1, 4)",0.33333333333333337,0.7777777777777778,0.4444444444444444,0.3333333333333333,False,0.4444444444444444
"Roberto fell as limp as wet leather, for the iron of salthorse and hardtack, and months of disciplinary labor, was in that blow.",wet leather,leather,wet,malleable,emergent,"(emergent, emergent, emergent)","(4, 5, 5)","(3, 3, 2)","(3, 4, 4)",0.4444444444444445,0.7777777777777778,0.3333333333333333,0.0,False,0.3333333333333333
"It's actually not as crazy as it looks it's a single awkward flip, sort of like a poor cartwheel.",a poor cartwheel,cartwheel,poor,ungraceful,emergent,"(emergent, emergent, emergent)","(5, 3, 4)","(4, 1, 2)","(4, 1, 2)",0.5555555555555556,0.8888888888888888,0.3333333333333333,0.3333333333333333,False,0.3333333333333333
"With the elections and stuff there is so much comedic potential, but for some reason the regular news sometimes is just as funny as the daily show.",the daily show,show,daily,humorous,emergent,"(emergent, emergent, emergent)","(5, 5, 5)","(3, 3, 3)","(2, 1, 2)",0.4444444444444445,0.7777777777777778,0.3333333333333333,0.3333333333333333,False,0.3333333333333333
"If the Tressillian and I meet, we shall be about as amicable as a rat and a beagle.",a rat and a beagle,rat,beagle,antagonistic,emergent,"(component, emergent, emergent)","(5, 4, 4)","(3, 3, 3)","(4, 2, 3)",0.3333333333333333,0.6666666666666666,0.3333333333333333,0.1111111111111111,False,0.3333333333333333
"Then the person walks on, and the memory gets blown away like mist at dawn.",mist at dawn,mist,dawn,dissipates quickly,emergent,"(emergent, emergent, emergent)","(5, 5, 5)","(4, 4, 4)","(3, 3, 3)",0.11111111111111105,0.6666666666666666,0.5555555555555556,0.3333333333333333,False,0.5555555555555556
Must men stand here like whipped curs until a slave commands us enter?,whipped curs,cur,whip,humiliate,emergent,"(emergent, emergent, emergent)","(5, 4, 5)","(3, 3, 2)","(4, 4, 4)",0.2222222222222222,0.7777777777777778,0.3333333333333333,0.5555555555555556,False,0.5555555555555556
"The letter to Mrs. Hargreaves, which, it will be noticed, was earlier in date than the short note already quoted in this chapter, ran as follows My Dear Mrs. Hargreaves,I fancy this will come to you almost like a voice from the dead, after so many years of silence, and yet those years have made no difference that I can perceive in my clearness of memory of the days when we did correspond.",a voice from the dead,voice,dead,haunt,emergent,"(emergent, component, emergent)","(5, 3, 5)","(3, 1, 3)","(4, 3, 5)",0.4444444444444445,0.7777777777777778,0.3333333333333333,0.3333333333333333,False,0.3333333333333333
"Thisnow that we are in the confessionalwe are free to ownyea, it is incumbent on us to do ourselves this justiceis only when we are in one of our unamiable moods, luckily about as rare as snow at midsummer, but correspondingly chilling and shocking to the genial ones around us,ourselves usually most so, like quiet sunshine in November.",snow at midsummer,snow,midsummer,unexpected,emergent,"(emergent, emergent, emergent)","(5, 5, 5)","(3, 3, 2)","(4, 5, 3)",0.6666666666666667,1.0,0.3333333333333333,0.1111111111111111,False,0.3333333333333333
"However great the value of the improvements, we cannot afford to be bankrupt, and a new productive Indian tax seems as distant as the philosopher's stone.",the philosopher's stone,stone,philosopher,elusive,emergent,"(emergent, emergent, component)","(4, 5, 5)","(4, 2, 3)","(5, 3, 4)",0.4444444444444444,1.0,0.0,0.5555555555555556,False,0.5555555555555556
"Then like a pawing horse let go, She made a sudden bound It flung the blood into my head,",a pawing horse,horse,paw,agitate,emergent,"(emergent, emergent, emergent)","(3, 3, 5)","(2, 1, 3)","(2, 1, 4)",0.3333333333333333,0.6666666666666666,0.3333333333333333,0.2222222222222222,False,0.3333333333333333
"Whence knowest thou if, when thy use is at an end as a vessel, he will not cast thee away like a broken plate?",a broken plate,plate,break,worthless,emergent,"(emergent, component, emergent)","(4, 5, 4)","(2, 2, 2)","(3, 4, 3)",0.4444444444444445,0.7777777777777778,0.2222222222222222,0.3333333333333333,False,0.3333333333333333
"I'm about to fuck dat hole in the middle of yo tits, just like a real lady.",a real lady,lady,real,refine,emergent,"(component, emergent, emergent)","(5, 4, 3)","(4, 3, 3)","(2, 2, 2)",0.0,0.3333333333333333,0.3333333333333333,0.3333333333333333,False,0.3333333333333333
It drinks from many garden plants as readily as wilder shrubs.,wilder shrubs,shrub,wilder,native,emergent,"(emergent, emergent, component)","(4, 3, 3)","(3, 3, 4)","(2, 2, 2)",0.22222222222222227,0.5555555555555556,0.3333333333333333,0.3333333333333333,False,0.3333333333333333
"Once it became clear there was no other way and we'd just sit there like test subjects forever if we said no, people agreed.",test subjects,subject,test,expendable,emergent,"(emergent, emergent, emergent)","(4, 5, 4)","(2, 3, 2)","(4, 4, 3)",0.4444444444444445,0.7777777777777778,0.3333333333333333,0.3333333333333333,False,0.3333333333333333
then i was riding a splendid bay horse as glossy as rocks in a riverbed .,rocks in a riverbed,rock,riverbed,polish,emergent,"(emergent, emergent, emergent)","(3, 5, 5)","(1, 3, 4)","(1, 4, 3)",0.22222222222222227,0.5555555555555556,0.3333333333333333,0.0,False,0.3333333333333333
"Elsie, who adored Clover, considered her as beautiful as girls in books, and was proud to be permitted to hem ruffles for the dress in which she was to burst upon the world.",girls in books,girl,book,fictional,emergent,"(emergent, emergent, emergent)","(5, 5, 5)","(2, 2, 2)","(4, 5, 5)",0.4444444444444445,0.7777777777777778,0.1111111111111111,0.3333333333333333,False,0.3333333333333333
It springs directly from the heart and it moves straight onward like a shaft of light.,a shaft of light,shaft,light,direct,emergent,"(emergent, emergent, component)","(5, 5, 5)","(3, 3, 3)","(4, 2, 4)",0.2222222222222222,0.7777777777777778,0.5555555555555556,0.3333333333333333,False,0.5555555555555556
I think comparing how things work in different countries for poor people is kind of like apples to oranges. ampx200B,apples to oranges,apple,orange,incompatible,emergent,"(emergent, emergent, emergent)","(5, 3, 5)","(2, 1, 2)","(2, 1, 2)",0.5555555555555556,0.7777777777777778,0.2222222222222222,0.0,False,0.2222222222222222
By April the grumblers grumbled again and no longer attempted to live as simply as soldiers under fire.,soldiers under fire,soldier,fire,vulnerable,emergent,"(emergent, emergent, emergent)","(5, 5, 5)","(4, 3, 3)","(5, 4, 4)",0.5555555555555556,0.8888888888888888,0.3333333333333333,0.0,False,0.3333333333333333
"McADAMS Audubon Society Basically what happens is that lights draw birds to them, sort of like the moth to the flame.",the moth to the flame,moth,flame,irresistible,emergent,"(emergent, emergent, emergent)","(5, 5, 5)","(2, 3, 3)","(3, 3, 4)",0.5555555555555556,0.8888888888888888,0.3333333333333333,0.3333333333333333,False,0.3333333333333333
"Their years glide away like the sands in an hourglass and, finally they sicken, faint and fall, and their end resembles the pebbles thrown into the ocean, which for a moment ripple the surface and lose themselves in its waves.",the sands in an hourglass,sand,hourglass,transient,emergent,"(emergent, emergent, emergent)","(5, 5, 5)","(3, 2, 3)","(4, 5, 4)",0.4444444444444444,1.0,0.5555555555555556,0.5555555555555556,False,0.5555555555555556
Dont lie there like a floundering donkey.,a floundering donkey,donkey,flounder,helpless,emergent,"(emergent, emergent, emergent)","(5, 5, 5)","(2, 3, 2)","(5, 4, 4)",0.2222222222222222,0.7777777777777778,0.3333333333333333,0.5555555555555556,False,0.5555555555555556
"She never quite recovered, but slowly withered away like a plucked flower.",a plucked flower,flower,pluck,weaken,emergent,"(emergent, component, emergent)","(5, 5, 5)","(3, 3, 2)","(5, 4, 3)",0.5555555555555556,0.8888888888888888,0.3333333333333333,0.3333333333333333,False,0.3333333333333333
This wasn't exactly like the Russian investigation.,the Russian investigation,investigation,russian,high,emergent,"(emergent, emergent, emergent)","(5, 4, 4)","(3, 3, 2)","(2, 2, 2)",0.0,0.3333333333333333,0.3333333333333333,0.0,False,0.3333333333333333
The way your Aunt Lavinia treated him was as funny as a cock without feathers.,a cock without feathers,cock,feather,ridiculous,emergent,"(emergent, emergent, emergent)","(4, 5, 4)","(2, 1, 2)","(1, 1, 1)",0.5555555555555556,0.7777777777777778,0.2222222222222222,0.1111111111111111,False,0.2222222222222222
His countenance was as serene as a morning without clouds.,a morning without clouds,morning,cloud,clear,emergent,"(emergent, component, emergent)","(5, 5, 5)","(3, 3, 4)","(5, 5, 5)",0.5555555555555556,0.8888888888888888,0.3333333333333333,0.0,False,0.3333333333333333
Street lights are droopin like popeye without spinach,popeye without spinach,popeye,spinach,weak,emergent,"(emergent, component, emergent)","(5, 5, 5)","(2, 4, 1)","(1, 5, 1)",0.7777777777777778,0.7777777777777778,0.0,0.0,False,0.0
"As Bertram and the brown made joint entrance to the square opposite the stableyard, dripping like a seahorse bestridden by a merman, he saw a feminine figure in the verandah of the barracks gesticulating wildly to him, and in a fashion demanding to be heard.",a seahorse bestridden,bestridden,seahorse,fantastical,emergent,"(emergent, emergent, emergent)","(4, 5, 5)","(1, 2, 2)","(3, 3, 4)",0.4444444444444445,0.7777777777777778,0.3333333333333333,0.3333333333333333,False,0.3333333333333333
They broke apart like weeds in a thunderstorm.,weeds in a thunderstorm,weed,thunderstorm,break apart,emergent,"(emergent, emergent, emergent)","(4, 5, 5)","(2, 2, 3)","(4, 4, 4)",0.0,0.2222222222222222,0.3333333333333333,0.2222222222222222,False,0.3333333333333333
"When wind rushed over her tracks they were blown away like sand over empires, erased forever. ",sand over empires,sand,empire,erased,emergent,"(emergent, emergent, emergent)","(4, 5, 4)","(2, 3, 2)","(3, 4, 3)",0.4444444444444445,0.7777777777777778,0.3333333333333333,0.3333333333333333,False,0.3333333333333333
"I don't happen to know anyone else, however if i did, they would be just like an onion writer.",an onion writer,writer,onion,satirical,emergent,"(emergent, emergent, emergent)","(5, 5, 5)","(4, 3, 3)","(5, 5, 5)",0.6666666666666667,1.0,0.3333333333333333,0.0,False,0.3333333333333333
"His situation is miserable he is truly a fish out of water he loves motion, but is obliged to stand still his glory is a social bit of jaw, but he dares not speak he rolls his disconsolate quid over his silent tongue, and is as wretched as a caged monkey.",a caged monkey,monkey,cage,unhappy,emergent,"(emergent, emergent, emergent)","(5, 5, 5)","(2, 3, 3)","(4, 4, 4)",0.22222222222222227,0.5555555555555556,0.3333333333333333,0.3333333333333333,False,0.3333333333333333
"james ' voice was as soft as the rustling of the leaves , and when i looked at him , i could see goose bumps standing out on his tanned legs .",the rustling of the leaves,rustling,leave,soothe,emergent,"(emergent, emergent, emergent)","(5, 4, 4)","(3, 1, 3)","(2, 1, 2)",0.22222222222222227,0.5555555555555556,0.3333333333333333,0.0,False,0.3333333333333333
"Forsaking the Raving Ravens, he had set forth to mobilize all the small, unattached boys at camp into the Pollywog Patrol, but the Pollywog Patrol had proved about as substantial as the shifting sand.",the shifting sand,sand,shift,unreliable,emergent,"(emergent, emergent, emergent)","(5, 5, 5)","(3, 3, 3)","(4, 4, 4)",0.4444444444444445,0.7777777777777778,0.3333333333333333,0.3333333333333333,False,0.3333333333333333
"Now if this was a consistent dumping that was millions and millions of gallons a yearmonthdaywhatever, then theres gonna start being an issue, but it seems kinda like a one time thing.",a one time thing,thing,time,non,emergent,"(emergent, 2, emergent)","(5, 3, 3)","(1, 1, 1)","(2, 2, 2)",1.0,1.0,0.0,0.0,False,0.0
"come along , grasp my hand properly amelia , you are as limp as a gasping fish .",a gasping fish,fish,gasp,helpless,emergent,"(emergent, emergent, emergent)","(5, 5, 4)","(2, 2, 2)","(4, 4, 2)",0.5555555555555556,0.8888888888888888,0.3333333333333333,0.3333333333333333,True,0.3333333333333333
their minds are as vacant as the minds of mushrooms . '',the minds of mushrooms,mind,mushroom,vacant,emergent,"(emergent, emergent, emergent)","(5, 5, 4)","(3, 1, 3)","(1, 1, 2)",0.4444444444444445,0.7777777777777778,0.3333333333333333,0.0,False,0.3333333333333333
"He looks at me, turning his eyes, but not his head, and keeps on marching up and down like a blessed image all he says was, Make an application to the officer in command, says he.",a blessed image,image,bless,idealize,emergent,"(emergent, emergent, emergent)","(5, 5, 5)","(4, 4, 4)","(4, 3, 3)",0.0,0.3333333333333333,0.3333333333333333,0.3333333333333333,False,0.3333333333333333
the doctor was rambling words incoherently like a possessed man .,a possessed man,man,possess,uncontrolle,emergent,"(component, emergent, emergent)","(4, 4, 5)","(3, 1, 2)","(4, 1, 5)",0.4444444444444445,0.7777777777777778,0.3333333333333333,0.3333333333333333,False,0.3333333333333333
"the last is a straight line that curves at the bottom , almost like the end of a machete . ''",the end of a machete,end,machete,point,emergent,"(component, emergent, emergent)","(5, 4, 5)","(4, 1, 4)","(2, 1, 3)",0.0,0.8888888888888888,1.0,0.3333333333333333,False,1.0
"Raisins rule, wanting chocolate chips in place if rasins in oatmeal cookies is as childish as ketchup on steak.",ketchup on steak,ketchup,steak,inappropriate,emergent,"(emergent, emergent, emergent)","(4, 3, 5)","(2, 1, 2)","(1, 1, 3)",0.4444444444444444,0.6666666666666666,0.2222222222222222,0.1111111111111111,False,0.2222222222222222
"About sunset the garrison gives notice of their return their faint cawing will be heard from a great distance, and they will be seen far off like a sable cloud, and then nearer and nearer, until they all come soaring home.",a sable cloud,cloud,sable,ominousness,emergent,"(emergent, emergent, emergent)","(5, 5, 5)","(3, 4, 3)","(4, 4, 4)",0.4444444444444445,0.7777777777777778,0.3333333333333333,0.3333333333333333,False,0.3333333333333333
"And it is to be feared that many in this day, who profess to be the successors of those primitive sufferers, our worthy predecessors, who stood faithful, and patiently bore the burden and heat of the day, through many years of cruel persecution, are now turning back like a broken bow and through the fear or favour of men, are disregarding the testimonies which their forefathers in the truth purchased at so dear a rate and are ready to account many of them but small, or as indifferent things, which may, or may not, be attended to at their own pleasure.",a broken bow,bow,break,useless,emergent,"(emergent, component, emergent)","(5, 3, 5)","(2, 4, 2)","(4, 5, 4)",0.4444444444444445,0.7777777777777778,0.2222222222222222,0.3333333333333333,False,0.3333333333333333
ambori 's as happy as a hog in slop right now . '',a hog in slop,hog,slop,satisfy,emergent,"(emergent, emergent, component)","(5, 5, 5)","(3, 2, 3)","(2, 4, 4)",0.5555555555555556,0.8888888888888888,0.3333333333333333,0.3333333333333333,False,0.3333333333333333
kind of like the rabbit in the sky ?,the rabbit in the sky,rabbit,sky,fantastical,emergent,"(emergent, emergent, emergent)","(5, 5, 5)","(2, 1, 1)","(3, 1, 1)",0.6666666666666666,0.8888888888888888,0.0,0.2222222222222222,False,0.2222222222222222
hes gon na be as mad as a wolf in a cage .,a wolf in a cage,wolf,cage,captive,emergent,"(component, emergent, emergent)","(5, 5, 5)","(4, 2, 3)","(5, 5, 5)",0.0,1.0,0.2222222222222222,1.0,False,1.0
But... you are as graceful as a three legged duck.',a three legged duck,duck,legged,lacking gracefulness,emergent,"(emergent, component, emergent)","(5, 4, 5)","(2, 3, 2)","(2, 1, 3)",0.4444444444444445,0.7777777777777778,0.3333333333333333,0.3333333333333333,False,0.3333333333333333
"The Indians, however, were quite as active as the searchers after wealth.",the searchers after wealth,searcher,wealth,greedy,emergent,"(emergent, emergent, emergent)","(5, 5, 5)","(2, 2, 3)","(4, 5, 4)",0.4444444444444445,0.7777777777777778,0.3333333333333333,0.3333333333333333,False,0.3333333333333333
"Sam took in an enormous gasp of air, pushing past my arms and bolting upright like a man possessed.",a man possessed,man,possess,frantic,emergent,"(emergent, emergent, emergent)","(5, 4, 4)","(1, 2, 1)","(1, 2, 1)",0.5555555555555556,0.8888888888888888,0.3333333333333333,0.0,False,0.3333333333333333
"More like people bitching that over 8 hours is too much work and then complain about the pay, rn our monthly wage is around 20002800, when we were working 14 hour days it was almost 6k.",people bitching,people,bitch,dissatisfy,emergent,"(component, emergent, emergent)","(5, 4, 5)","(3, 1, 3)","(4, 1, 4)",0.4444444444444445,0.7777777777777778,0.3333333333333333,0.3333333333333333,False,0.3333333333333333
"The hide is uncoloured and is much better than you will find in Cairo , though not as supple as Florentine work .",Florentine work,work,florentine,high,emergent,"(component, emergent, emergent)","(4, 4, 5)","(3, 3, 3)","(4, 3, 4)",0.0,0.3333333333333333,0.3333333333333333,0.0,False,0.3333333333333333
"The men slunk back like whipped curs, but made no response.",whipped curs,cur,whip,submissive,emergent,"(emergent, emergent, emergent)","(5, 5, 5)","(3, 3, 3)","(4, 4, 4)",0.33333333333333326,0.8888888888888888,0.5555555555555556,0.3333333333333333,False,0.5555555555555556
I think comparing how things work in different countries for poor people is kind of like apples to oranges. ampx200B,apples to oranges,apple,orange,dissimilar,emergent,"(emergent, emergent, emergent)","(5, 5, 5)","(2, 1, 2)","(2, 1, 2)",0.5555555555555556,0.8888888888888888,0.0,0.3333333333333333,False,0.3333333333333333
"Insist that all the monks come, explaining that you fear we have but few moments to live, and that the Abbot alone would be as helpless as one surgeon on a battlefield.",one surgeon on a battlefield,surgeon,battlefield,isolate,emergent,"(emergent, emergent, emergent)","(4, 4, 4)","(2, 2, 3)","(3, 3, 2)",0.4444444444444445,0.7777777777777778,0.3333333333333333,0.3333333333333333,False,0.3333333333333333
"I know this is probably waaay too deep for the joke, but running around like a chicken with no head is a fairly accurate description of the Quran.",a chicken with no head,chicken,head,disorient,emergent,"(emergent, emergent, emergent)","(5, 5, 5)","(3, 3, 2)","(3, 4, 4)",0.7777777777777778,1.0,0.2222222222222222,0.1111111111111111,False,0.2222222222222222
"Which might be true, but the onus of proof is the one making a positive claim, especially if it is one as large as the creator of the universe.",the creator of the universe,creator,universe,all,emergent,"(emergent, component, emergent)","(5, 5, 5)","(4, 4, 4)","(5, 5, 5)",0.0,1.0,0.0,1.0,False,1.0
You're just like a stuffed crocodile.,a stuffed crocodile,crocodile,stuff,lifeless,emergent,"(emergent, component, emergent)","(5, 5, 5)","(2, 2, 2)","(4, 4, 4)",0.6666666666666667,1.0,0.0,0.3333333333333333,False,0.3333333333333333
but it will do so at a cost and it won't be as good as a larger sensor.,a larger sensor,sensor,large,superior,emergent,"(emergent, emergent, emergent)","(4, 4, 4)","(2, 2, 1)","(3, 3, 2)",0.3333333333333333,0.6666666666666666,0.3333333333333333,0.3333333333333333,False,0.3333333333333333
,day from night,day,night,opposite,emergent,"(component, emergent, emergent)","(5, 5, 5)","(4, 4, 3)","(4, 4, 3)",1.0,1.0,0.0,0.0,False,0.0
"that was as dangerous as the blood loss , if not more so .",the blood loss,loss,blood,life,emergent,"(emergent, emergent, component)","(4, 5, 5)","(1, 3, 2)","(2, 5, 5)",0.0,0.0,0.0,0.8888888888888888,False,0.8888888888888888
"in the meantime , '' suggested jackin ' jill , why do n't you go lick yourself clean like a good kitty ? ''",a good kitty,kitty,good,well,emergent,"(component, emergent, emergent)","(5, 5, 4)","(3, 2, 2)","(4, 4, 4)",0.2222222222222222,0.7777777777777778,0.3333333333333333,0.5555555555555556,False,0.5555555555555556
and are treated slightly like people of colour before they were able to obtain equality which to this day is rocky.,people of colour,people,colour,discriminate,emergent,"(emergent, emergent, component)","(5, 5, 5)","(2, 3, 2)","(4, 4, 2)",0.0,0.0,0.5555555555555556,0.3333333333333333,False,0.5555555555555556
"The ledge of rock which forms this lower arch is not above two feet and a half high above the water, and under this we were to pass in the boat so that we were fain to pile ourselves flat upon each other like a layer of herrings.",a layer of herrings,layer,herring,close,emergent,"(component, emergent, emergent)","(4, 4, 4)","(2, 1, 3)","(3, 1, 2)",0.4444444444444445,0.7777777777777778,0.3333333333333333,0.0,False,0.3333333333333333
He cavorted about as gracefully as an animated sausage.,an animated sausage,sausage,animate,awkward,emergent,"(emergent, emergent, emergent)","(5, 3, 5)","(2, 2, 2)","(3, 2, 3)",0.4444444444444445,0.7777777777777778,0.2222222222222222,0.3333333333333333,False,0.3333333333333333
"The grass in this part of the plain was fresh and green, and looked almost like an English lawn, there having been rain about three weeks before.",an English lawn,lawn,english,well,emergent,"(emergent, emergent, component)","(5, 3, 4)","(3, 1, 3)","(3, 1, 2)",0.5555555555555556,0.5555555555555556,0.0,0.0,False,0.0
"I've heard this joke before, except just like jew jokes, it tends to bleed through into people's actual beliefs.",jew jokes,joke,jew,insensitive,emergent,"(component, emergent, emergent)","(5, 5, 5)","(3, 3, 3)","(2, 2, 1)",0.5555555555555556,0.8888888888888888,0.3333333333333333,0.0,False,0.3333333333333333
It's really like a submarine in space.,a submarine in space,submarine,space,improbable,emergent,"(emergent, emergent, emergent)","(5, 5, 5)","(3, 2, 3)","(4, 2, 4)",0.6666666666666667,1.0,0.1111111111111111,0.3333333333333333,False,0.3333333333333333
"oh well , the two went together like franks and beans .",franks and beans,frank,bean,comfort,emergent,"(2, emergent, emergent)","(1, 5, 4)","(1, 2, 2)","(1, 3, 3)",0.3333333333333333,0.6666666666666666,0.3333333333333333,0.3333333333333333,False,0.3333333333333333
"only just turned twentythree , saqib had been as straight as an arrow growing up , never in trouble and never causing any .",an arrow growing up,arrow,grow,upright,emergent,"(emergent, component, emergent)","(5, 3, 4)","(4, 1, 5)","(3, 3, 3)",0.6666666666666667,1.0,0.3333333333333333,0.3333333333333333,False,0.3333333333333333
Matter without motion is just as unthinkable as motion without matter.,motion without matter,motion,matter,impossible,emergent,"(emergent, emergent, emergent)","(5, 5, 5)","(2, 2, 2)","(5, 3, 2)",1.0,1.0,0.0,0.0,False,0.0
