sentence,combination,root,modifier,property,human_label_majority,meta.human_labels,meta.combination_human_relevance,meta.root_human_relevance,meta.modifier_human_relevance,meta.gpt-4o_emergence,meta.combination_gpt-4o_relevance,meta.root_gpt-4o_relevance,meta.modifier_gpt-4o_relevance,meta.toxicity,meta.gpt-4o_indiv_max
"53 I have given up on my aim, now like a good girl, i sit to pee.",a good girl,girl,good,well,emergent,"(emergent, component, emergent)","(5, 4, 5)","(2, 2, 2)","(4, 4, 5)",0.11111111111111105,0.6666666666666666,0.3333333333333333,0.5555555555555556,False,0.5555555555555556
"I mean, I was as poor as any kid in the projects but we were a poor white family on welfare that mostly lived in cars, trailers or whatever low income housingmotel would have us for a few months.",any kid in the projects,kid,project,disadvantage,emergent,"(emergent, emergent, emergent)","(5, 5, 5)","(2, 2, 2)","(4, 4, 4)",0.4444444444444445,0.7777777777777778,0.3333333333333333,0.3333333333333333,False,0.3333333333333333
"In a study, some of the infected juveniles were only half as heavy as controls with no worms.",controls with no worms,control,worm,healthy,emergent,"(emergent, emergent, emergent)","(2, 3, 2)","(2, 2, 2)","(1, 1, 1)",0.0,0.3333333333333333,0.3333333333333333,0.3333333333333333,False,0.3333333333333333
"Your sweat and blood still glistened, almost alive like a molted skin, and your skin softly shone in the headlights of the police cars.",a molted skin,skin,molted,lifeless,emergent,"(emergent, emergent, emergent)","(4, 4, 5)","(2, 1, 3)","(3, 1, 4)",0.6666666666666667,1.0,0.0,0.3333333333333333,False,0.3333333333333333
"Please go and see it, it was a moving film if you even remotely like the original trilogy.",the original trilogy,trilogy,original,belove,emergent,"(component, emergent, emergent)","(5, 5, 5)","(3, 2, 3)","(3, 3, 3)",0.4444444444444445,0.7777777777777778,0.3333333333333333,0.3333333333333333,False,0.3333333333333333
"He became bigger than the personnel of the case, as big as the woman in the dock.",the woman in the dock,woman,dock,accuse,emergent,"(component, emergent, emergent)","(3, 5, 5)","(1, 2, 2)","(2, 3, 5)",0.7777777777777778,0.7777777777777778,0.0,0.0,False,0.0
"Mark sometimes makes as high as five dollars a week, said Mrs. Mason in a tone of mild sarcasm.",five dollars a week,dollar,week,insufficient,emergent,"(emergent, emergent, emergent)","(5, 4, 5)","(1, 3, 1)","(1, 2, 1)",0.5555555555555556,0.8888888888888888,0.3333333333333333,0.3333333333333333,False,0.3333333333333333
"This gentleman, convinced that a silvermine without silver is as rare as an effect without a cause, discovered the sparkle of the precious element deep down in the reasons of things.",an effect without a cause,effect,cause,absurd,emergent,"(emergent, emergent, emergent)","(5, 5, 4)","(2, 1, 1)","(3, 1, 1)",0.6666666666666666,0.8888888888888888,0.2222222222222222,0.1111111111111111,False,0.2222222222222222
What he fails to add is that nowadays information is as leaky as a fistful of sand .,a fistful of sand,fistful,sand,unreliable,emergent,"(emergent, emergent, emergent)","(4, 4, 4)","(2, 1, 2)","(3, 2, 2)",0.4444444444444445,0.7777777777777778,0.3333333333333333,0.3333333333333333,False,0.3333333333333333
"Yeah I mean I'm guessing the prison staff are willing to go off menu in some cases if it's as straightforward as a trip down the street to a fast food joint, but if your request was something like, I want this incredibly obscure Burmese dish that only 3 chefs in the entire world know how to properly cook, you can't kill me until I get it!",a trip down the street,trip,street,simple,emergent,"(emergent, emergent, emergent)","(5, 5, 5)","(1, 2, 3)","(1, 1, 4)",0.4444444444444445,0.7777777777777778,0.3333333333333333,0.3333333333333333,False,0.3333333333333333
"She stood as still as a scolded mutt, her ferocious, daggerlike fangs bared in a snarl that had no real teeth, and the man with her stone knew it.","a scolded mutt,",mutt,scold,subdue,emergent,"(component, emergent, emergent)","(5, 4, 5)","(2, 2, 2)","(5, 4, 4)",0.4444444444444445,0.7777777777777778,0.2222222222222222,0.3333333333333333,False,0.3333333333333333
"still , the last couple of times hed run into reuben , hed been about as friendly as a wet cat .",a wet cat,cat,wet,uninvite,emergent,"(emergent, emergent, emergent)","(5, 3, 4)","(2, 1, 2)","(4, 1, 3)",0.3333333333333333,0.6666666666666666,0.3333333333333333,0.0,False,0.3333333333333333
They both love BBT because they say theyve known so many guys just like the nerds on the show and they find it hilarious.,the nerds on the show,nerd,show,socially awkward,emergent,"(emergent, emergent, component)","(4, 5, 4)","(4, 4, 4)","(2, 2, 2)",0.11111111111111105,0.6666666666666666,0.5555555555555556,0.3333333333333333,False,0.5555555555555556
"I remember I was really nervous, but also excited that I was now like the big kids, going to school.",the big kids,kid,big,old,emergent,"(emergent, emergent, emergent)","(3, 2, 2)","(1, 1, 1)","(1, 2, 3)",0.0,0.3333333333333333,0.0,0.3333333333333333,False,0.3333333333333333
"I had one for a while when I was a teenager, be prepared to smell faintly like lighter fluid whenever you have it on you.",lighter fluid,fluid,light,flammable,emergent,"(component, emergent, emergent)","(5, 5, 5)","(3, 3, 3)","(4, 4, 1)",0.6666666666666667,1.0,0.3333333333333333,0.0,False,0.3333333333333333
Now these conclusions struck me abrupt like a bat in the eye when I sat down to rest in camp at Echo Spring.,a bat in the eye,bat,eye,sudden,emergent,"(emergent, emergent, emergent)","(4, 5, 5)","(1, 3, 3)","(1, 2, 2)",0.5555555555555556,0.8888888888888888,0.3333333333333333,0.0,False,0.3333333333333333
"Ideally, you want a 911 joke to be as funny as two pies to the face and one thrown at a field in Pennsylvania.",two pies to the face and,pie,face,humorous,emergent,"(emergent, emergent, emergent)","(5, 5, 5)","(3, 2, 2)","(4, 4, 2)",0.4444444444444445,0.7777777777777778,0.2222222222222222,0.3333333333333333,False,0.3333333333333333
"He was impatient, cross, and implacable and Lord Montague, an English nobleman, who was at that time much about him, remarked in a low voice to one of the gentlemen in waiting, His Majesty is as peevish as a crossed child, when Cinq Mars is absent.",a crossed child,child,crossed,grumpy,emergent,"(emergent, component, emergent)","(5, 5, 5)","(3, 3, 3)","(4, 4, 4)",0.4444444444444445,0.7777777777777778,0.3333333333333333,0.3333333333333333,False,0.3333333333333333
"she could see bombarda too , resting in his room , and she knew that she herself was becoming a keeper , just like the creature kai .",the creature kai,kai,creature,fantastical,emergent,"(emergent, emergent, emergent)","(5, 4, 5)","(3, 3, 3)","(4, 5, 4)",0.6666666666666667,1.0,0.3333333333333333,0.3333333333333333,False,0.3333333333333333
It was almost like a dry hurricane.,a dry hurricane,hurricane,dry,unusual,emergent,"(emergent, emergent, emergent)","(5, 5, 5)","(4, 2, 3)","(4, 4, 4)",0.33333333333333337,1.0,0.6666666666666666,0.1111111111111111,False,0.6666666666666666
"After the match, New Zealand captain Benji Marshall claimed that his side was at least as good as the Australian team, citing that the difference in the scoreline was caused only by Australia's better goalkicking.",the Australian team,team,australian,skilled,emergent,"(component, emergent, emergent)","(4, 4, 4)","(3, 3, 4)","(2, 2, 2)",0.4444444444444445,0.7777777777777778,0.3333333333333333,0.3333333333333333,False,0.3333333333333333
"This one is open, all aflame like a burning bush.",a burning bush,bush,burn,symbolic,emergent,"(emergent, emergent, emergent)","(5, 5, 5)","(3, 2, 2)","(2, 1, 3)",0.2222222222222222,0.7777777777777778,0.3333333333333333,0.5555555555555556,False,0.5555555555555556
"To the village, I was just a sickly, thin girl at the time of her death, so they threw me away like a broken plaything. ",a broken plaything,plaything,broken,discarded,emergent,"(emergent, emergent, emergent)","(5, 5, 5)","(2, 3, 2)","(4, 4, 4)",0.0,0.7777777777777778,0.5555555555555556,0.7777777777777778,False,0.7777777777777778
all the kitsch and puns were about as charming as a poke in the eye .,a poke in the eye,poke,eye,painful,emergent,"(emergent, emergent, component)","(5, 5, 5)","(4, 4, 3)","(3, 3, 4)",0.5555555555555556,0.8888888888888888,0.3333333333333333,0.3333333333333333,False,0.3333333333333333
So we found the comet is kind of like fire and ice.,fire and ice,fire,ice,contrast,emergent,"(component, emergent, emergent)","(5, 5, 5)","(4, 3, 4)","(4, 3, 3)",0.4444444444444444,1.0,0.5555555555555556,0.3333333333333333,False,0.5555555555555556
"I had an inflatable red armchair just like the one on the show, and I insisted that my dad blow it up for me every time the show came on.",the one on the show,one,show,popular,emergent,"(emergent, emergent, emergent)","(4, 4, 5)","(2, 3, 2)","(3, 3, 4)",0.22222222222222227,0.5555555555555556,0.3333333333333333,0.3333333333333333,False,0.3333333333333333
"or was it anywhere threatening , anywhere richard 's precarious control , as insecure as an unbroken horse , might slip away from him ?",an unbroken horse,horse,unbroken,untraine,emergent,"(emergent, component, emergent)","(5, 5, 5)","(3, 3, 3)","(5, 5, 4)",0.5555555555555556,0.8888888888888888,0.3333333333333333,0.0,False,0.3333333333333333
the ocean had turned as gray as the washed out road .,the washed out road,road,wash,dilapidate,emergent,"(emergent, emergent, emergent)","(5, 5, 5)","(3, 3, 3)","(1, 3, 4)",0.4444444444444445,0.7777777777777778,0.3333333333333333,0.1111111111111111,False,0.3333333333333333
Just going to say that church is an easy way to make a profit and in a lot of ways is exactly like the drug trade.,the drug trade,trade,drug,unethical,emergent,"(emergent, emergent, emergent)","(4, 5, 5)","(1, 2, 2)","(2, 4, 5)",0.5555555555555556,0.8888888888888888,0.3333333333333333,0.3333333333333333,True,0.3333333333333333
This printing press was said to be twice as fast as the previous model and was composed of copperzinc and leadtin alloys.,the previous model,model,previous,outdate,emergent,"(component, emergent, emergent)","(5, 5, 5)","(4, 3, 2)","(5, 4, 5)",0.4444444444444445,0.7777777777777778,0.3333333333333333,0.3333333333333333,False,0.3333333333333333
The journey was successfully made and the coming of Boone was to his wife almost like the return of one from the dead.,the return of one from the dead,return,dead,miraculous,emergent,"(emergent, emergent, emergent)","(5, 5, 5)","(2, 3, 3)","(4, 2, 4)",0.6666666666666667,1.0,0.3333333333333333,0.0,False,0.3333333333333333
"i reckon i am at that , seein as how youre about as useful as a bucket with no bottom . ''",a bucket with no bottom,bucket,bottom,useless,emergent,"(emergent, emergent, emergent)","(5, 5, 5)","(3, 1, 3)","(3, 1, 2)",0.7777777777777778,1.0,0.1111111111111111,0.2222222222222222,False,0.2222222222222222
"Non natural nor spontaneous scripted internet bits are very cringy instead of funny for me, much more if the point of the bit is supposed to be unintentional like an actual fall.",an actual fall,fall,actual,unexpected,emergent,"(emergent, emergent, emergent)","(4, 5, 4)","(3, 4, 3)","(2, 1, 2)",0.2222222222222222,0.7777777777777778,0.5555555555555556,0.1111111111111111,False,0.5555555555555556
The Creature's milky white eye slid open like a small bulb.,a small bulb,bulb,small,dim,emergent,"(emergent, component, emergent)","(4, 5, 4)","(3, 4, 3)","(4, 4, 2)",0.22222222222222227,0.5555555555555556,0.3333333333333333,0.3333333333333333,False,0.3333333333333333
"Darby was riding his Blunderbuss, a big raking brute of a roan, with a head like a clawhammer and a mouth as hard as beaten brass, and on the sloping hillside it had hard work to keep clear of the viciously lunging horns.",beaten brass,brass,beat,texture,emergent,"(emergent, emergent, emergent)","(5, 5, 5)","(5, 3, 3)","(4, 4, 4)",0.4444444444444445,0.7777777777777778,0.3333333333333333,0.3333333333333333,False,0.3333333333333333
"That is idiotic, and autistic people are not idiots, they are as intelligent as people without the condition, some of the considerably smarter.",people without the condition,people,condition,neurotypical,emergent,"(emergent, emergent, emergent)","(5, 5, 5)","(3, 3, 3)","(5, 3, 2)",0.5555555555555556,0.8888888888888888,0.3333333333333333,0.0,False,0.3333333333333333
"In effect, the reason I came out is it was like kind of like a slap on the wrist.",a slap on the wrist,slap,wrist,lenient,emergent,"(emergent, emergent, emergent)","(5, 5, 5)","(1, 2, 1)","(1, 1, 1)",0.7777777777777777,0.8888888888888888,0.1111111111111111,0.0,False,0.1111111111111111
The idea expressed is as commonplace as cold mutton.,cold mutton,mutton,cold,unremarkable,emergent,"(emergent, emergent, emergent)","(3, 4, 3)","(2, 2, 1)","(3, 3, 1)",0.22222222222222227,0.5555555555555556,0.3333333333333333,0.3333333333333333,False,0.3333333333333333
Throughout his capture he had remained as mute as a trapped wolf.,a trapped wolf,wolf,trap,helpless,emergent,"(emergent, component, emergent)","(5, 5, 5)","(2, 2, 2)","(4, 5, 3)",0.2222222222222222,0.7777777777777778,0.0,0.5555555555555556,False,0.5555555555555556
"and sometimes far away like a windblown cry, and sometimes like a whisper close to my face.",a windblown cry,cry,windblown,unreachable,emergent,"(emergent, emergent, emergent)","(4, 4, 5)","(3, 1, 3)","(4, 1, 4)",0.33333333333333337,0.5555555555555556,0.0,0.2222222222222222,False,0.2222222222222222
The style that it's written is almost like a laboratory notebook.,a laboratory notebook,notebook,laboratory,meticulously detailed,emergent,"(emergent, emergent, component)","(5, 5, 5)","(2, 3, 3)","(4, 4, 4)",0.0,0.7777777777777778,0.3333333333333333,0.7777777777777778,False,0.7777777777777778
Babies with teeth are almost as scary as birds with arms...,birds with arms,bird,arm,unexpected,emergent,"(emergent, emergent, emergent)","(5, 5, 5)","(2, 2, 2)","(1, 2, 3)",0.6666666666666667,1.0,0.3333333333333333,0.1111111111111111,False,0.3333333333333333
"Also, a study by Bonkovsky and Mehta reported that, just like shared needles, the sharing of straws used to snort cocaine can spread blood diseases such as Hepatitis C. The responsible user therefore acts to minimize the spread of bloodborne viruses such as hepatitis C and HIV in the wider community and reduce their own risk exposure to drugrelated harms.",shared needles,needle,share,harmful,emergent,"(emergent, emergent, emergent)","(5, 5, 5)","(3, 4, 3)","(2, 2, 4)",0.5555555555555556,0.8888888888888888,0.3333333333333333,0.1111111111111111,False,0.3333333333333333
"Microsoft still cannot break free from being addicted to reboots for everything under the sun, although XP isn't nearly as bad as earlier versions.",earlier versions,version,early,outdate,emergent,"(emergent, component, emergent)","(5, 5, 5)","(3, 4, 4)","(4, 5, 3)",0.4444444444444445,0.7777777777777778,0.3333333333333333,0.1111111111111111,False,0.3333333333333333
"Loudly and fast on the Ridge Road beat The regular fall of Fearnaught's feet, On his broad, bare back his rider's seat Was as firm as the tread of the steed so fleet Small need of saddle, or bridle rein, He answered as well her touch on his mane.",the tread of the steed,tread,steed,rhythmic,emergent,"(component, emergent, emergent)","(5, 5, 5)","(4, 4, 4)","(2, 2, 3)",0.2222222222222222,0.7777777777777778,0.3333333333333333,0.5555555555555556,False,0.5555555555555556
Even like the fallen angels!,the fallen angels,angel,fall,rebellious,emergent,"(emergent, emergent, emergent)","(5, 5, 5)","(2, 2, 2)","(4, 4, 5)",0.7777777777777777,0.8888888888888888,0.1111111111111111,0.0,False,0.1111111111111111
"Now, I'm not saying that Manard wasn't as dead as a dried herring.",a dried herring,herring,dry,dead,emergent,"(emergent, emergent, component)","(4, 4, 5)","(1, 3, 2)","(1, 2, 2)",0.6666666666666667,1.0,0.3333333333333333,0.3333333333333333,False,0.3333333333333333
You're just as valuable as service members and I imagine your injury was no less horrible and traumatic.,service members,member,service,courageous,emergent,"(emergent, emergent, component)","(5, 5, 5)","(2, 2, 2)","(4, 4, 4)",0.4444444444444445,0.7777777777777778,0.3333333333333333,0.3333333333333333,False,0.3333333333333333
"Dearest Olejniczka, I left papa, I left sister and brother and you to start out in the wide world, and today I am yearning and fading away like the world without the sun.",the world without the sun,world,sun,bleak,emergent,"(emergent, emergent, emergent)","(5, 5, 5)","(2, 3, 3)","(3, 3, 4)",0.6666666666666667,1.0,0.3333333333333333,0.0,False,0.3333333333333333
"On the other hand, they considered the 3DS version being more than twice as expensive as the mobile version to be a negative, even with the costume sets, which were paid for DLC in the mobile version, being bundled into the retail release.",the mobile version,version,mobile,cheap,emergent,"(emergent, component, emergent)","(3, 4, 4)","(2, 2, 2)","(3, 3, 3)",0.22222222222222227,0.5555555555555556,0.3333333333333333,0.3333333333333333,False,0.3333333333333333
"he was as still as a creature of the wood , sensing a predator , before the inevitable attempt at flight . ",a creature of the wood,creature,wood,camouflaged,emergent,"(emergent, emergent, emergent)","(5, 5, 5)","(3, 4, 2)","(4, 5, 4)",0.22222222222222227,0.5555555555555556,0.3333333333333333,0.3333333333333333,False,0.3333333333333333
you see why i did not want kids in the first place because if it were just me i would not care that much and just shoulder on regardless as i usually land on my feet just like a cat with nine lives .,a cat with nine lives,cat,life,lucky,emergent,"(emergent, emergent, emergent)","(5, 5, 5)","(2, 2, 3)","(3, 2, 2)",0.4444444444444445,0.7777777777777778,0.3333333333333333,0.3333333333333333,False,0.3333333333333333
"Why, I'm afraid to even snore in my sleep, said one of them, for fear I'll discharge the guncotton and as for kicking in my sleepwhy, I'm as quiet as a drugged snake.",a drugged snake,snake,drug,inactive,emergent,"(component, emergent, emergent)","(5, 5, 5)","(2, 4, 2)","(5, 3, 4)",0.4444444444444445,0.7777777777777778,0.3333333333333333,0.3333333333333333,False,0.3333333333333333
,a ginger kid,kid,ginger,red-haired,emergent,"(emergent, component, emergent)","(5, 5, 5)","(2, 2, 1)","(5, 5, 5)",0.0,0.8888888888888888,0.3333333333333333,0.8888888888888888,False,0.8888888888888888
"The elderly are as oblivious as distracted drivers, but will be given favorable treatment getting warning instead of ticket by cops because they've paid their dues to society",distracted drivers,driver,distract,unsafe,emergent,"(emergent, emergent, emergent)","(5, 5, 5)","(3, 4, 5)","(5, 4, 5)",0.5555555555555556,0.8888888888888888,0.3333333333333333,0.3333333333333333,False,0.3333333333333333
"So the victorious cry of the Koran or the sword swept onward like a trumpet call, and the man who raised it, before he diedand he died in 632found half the inhabited world ready to cry with him that Allah was God, and Mahomed was His prophet.",a trumpet call,call,trumpet,rally,emergent,"(component, emergent, emergent)","(5, 4, 5)","(4, 3, 3)","(4, 2, 3)",0.4444444444444445,0.7777777777777778,0.3333333333333333,0.3333333333333333,False,0.3333333333333333
"He's rather a dull doggood as gold, but as tasteless as an egg without salt.",an egg without salt,egg,salt,unexcite,emergent,"(emergent, emergent, emergent)","(3, 2, 4)","(3, 1, 2)","(2, 1, 3)",0.22222222222222227,0.5555555555555556,0.3333333333333333,0.3333333333333333,False,0.3333333333333333
"Oh, a man with an open mind is just as disagreeable as a man without prejudices.",a man without prejudices,man,prejudice,unbiased,emergent,"(emergent, emergent, emergent)","(5, 5, 5)","(4, 2, 2)","(4, 4, 5)",0.5555555555555556,0.8888888888888888,0.3333333333333333,0.0,False,0.3333333333333333
"The whole thing wants a great deal of working up,' he said 'all this foreground is very imperfectit is too like an English garden.",an English garden,garden,english,idealize,emergent,"(emergent, emergent, emergent)","(3, 5, 4)","(1, 3, 2)","(2, 4, 2)",0.22222222222222227,0.5555555555555556,0.3333333333333333,0.3333333333333333,False,0.3333333333333333
"my duffle of clothes was sitting on a narrow bed , almost as narrow as the bed on the train .",the bed on the train,bed,train,narrow,emergent,"(emergent, emergent, emergent)","(4, 5, 4)","(1, 3, 2)","(1, 3, 3)",0.4444444444444445,0.7777777777777778,0.3333333333333333,0.1111111111111111,False,0.3333333333333333
Taking two seconds of it and showing it out of context is about as funny as a punchline out of context.,a punchline out of context,punchline,context,unfunny,emergent,"(emergent, emergent, emergent)","(5, 5, 5)","(3, 2, 2)","(4, 3, 4)",0.4444444444444445,0.7777777777777778,0.2222222222222222,0.3333333333333333,False,0.3333333333333333
"Not quite, its typically still white, and thicker than milk but not sticky like condensed milk If that makes sense.",condensed milk,milk,condense,sweet,emergent,"(emergent, component, emergent)","(4, 5, 3)","(3, 2, 3)","(3, 3, 4)",0.6666666666666667,1.0,0.3333333333333333,0.0,False,0.3333333333333333
"but when trevor 's eyes caught edgard 's , the punch of lust whomped him as sharply as a hoof to the belly , making him just as breathless .",a hoof to the belly,hoof,belly,jarring,emergent,"(emergent, emergent, emergent)","(5, 5, 5)","(4, 4, 3)","(3, 3, 3)",0.5555555555555556,0.8888888888888888,0.3333333333333333,0.1111111111111111,False,0.3333333333333333
"Harry had fallen to a sentimental mood, and would talk about their future just as though it had all been settled in the beginning of things, and was as unalterable as the course of the planets.",the course of the planets,course,planet,unalterable,emergent,"(emergent, emergent, emergent)","(5, 5, 4)","(4, 3, 3)","(3, 4, 2)",0.5555555555555556,0.8888888888888888,0.2222222222222222,0.3333333333333333,False,0.3333333333333333
"The stoppage was not so great, therefore, as altogether to arrest the progress of the stream but this sudden obstacle created an accumulation of water behind it, which went on increasing for nearly an hour, till, becoming too powerful to be longer resisted, the enormous dam began to yield, and was swept off at once, and hurled onwards like a floating island.",a floating island,island,float,unstable,emergent,"(emergent, emergent, emergent)","(5, 5, 3)","(4, 2, 2)","(5, 4, 4)",0.22222222222222227,0.5555555555555556,0.2222222222222222,0.3333333333333333,False,0.3333333333333333
"He'll just have to dig it out, just like a wedge cut.",a wedge cut,cut,wedge,requiring effort,emergent,"(emergent, emergent, emergent)","(5, 5, 5)","(4, 3, 4)","(3, 4, 3)",0.0,0.3333333333333333,0.5555555555555556,0.3333333333333333,False,0.5555555555555556
"Now considering Earth exists I doubt life is as unlikely as a cube planet, but you get my point. ",a cube planet,planet,cube,improbable,emergent,"(emergent, emergent, emergent)","(5, 5, 5)","(2, 1, 2)","(4, 1, 4)",1.0,1.0,0.0,0.0,False,0.0
I really dont understand how these two get mixed up as they look about as similar as a house and a dragonfly.,a house and a dragonfly,house,dragonfly,dissimilar,emergent,"(emergent, emergent, emergent)","(4, 5, 5)","(2, 2, 1)","(2, 2, 1)",0.5555555555555556,0.8888888888888888,0.0,0.3333333333333333,False,0.3333333333333333
"cried Roger, he creeps away like a beaten hound, and Virginia saw the bowlderlike shadow rolling off toward the palisade.",a beaten hound,hound,beat,pitiful,emergent,"(emergent, emergent, emergent)","(5, 5, 4)","(1, 3, 4)","(3, 5, 3)",0.4444444444444445,0.7777777777777778,0.2222222222222222,0.3333333333333333,False,0.3333333333333333
"stopping was about as appealing as a bat to the kneecaps , but i did it .",a bat to the kneecaps,bat,kneecap,painful,emergent,"(emergent, component, emergent)","(5, 5, 5)","(4, 4, 3)","(4, 5, 4)",0.6666666666666667,1.0,0.2222222222222222,0.3333333333333333,False,0.3333333333333333
"that one was predictable , julian said , his eyes as dark as shards of obsidian .",shards of obsidian,shard,obsidian,dangerous,emergent,"(emergent, component, emergent)","(4, 5, 5)","(2, 4, 4)","(1, 5, 4)",0.4444444444444445,0.7777777777777778,0.3333333333333333,0.3333333333333333,False,0.3333333333333333
"The men slunk back like whipped curs, but made no response.",whipped curs,cur,whip,submiss,emergent,"(emergent, emergent, emergent)","(4, 4, 5)","(3, 1, 3)","(2, 1, 4)",0.4444444444444445,0.7777777777777778,0.3333333333333333,0.3333333333333333,False,0.3333333333333333
"An excellent sauce for boiled fish may be made thus Put a piece of butter as big as an egg in a saucepan or a tomato can heat till it bubbles, add a heaping tablespoonful of flour, stir till quite smooth pour slowly into this, stirring continually, a pint of the water the fish was cooked in, and add two hardboiled eggs chopped fine.",an egg in a saucepan,egg,saucepan,cook,emergent,"(emergent, emergent, component)","(5, 5, 5)","(4, 3, 4)","(3, 4, 4)",0.0,0.8888888888888888,0.5555555555555556,0.8888888888888888,False,0.8888888888888888
It's a vital organ to humanities growth and survival and instead of staying inside and enjoying the safety they're like fuck that and hang outside like true bosses.,true bosses,boss,TRUE,fearless,emergent,"(emergent, emergent, emergent)","(4, 5, 5)","(3, 3, 3)","(1, 4, 4)",0.2222222222222222,0.7777777777777778,0.5555555555555556,0.0,False,0.5555555555555556
"This must be a great time for him, almost like a pig in mud.",a pig in mud,pig,mud,happy,emergent,"(emergent, emergent, emergent)","(4, 4, 5)","(2, 2, 2)","(2, 3, 1)",0.33333333333333326,0.8888888888888888,0.5555555555555556,0.0,False,0.5555555555555556
