sentence,combination,root,modifier,property,human_label_majority,meta.human_labels,meta.combination_human_relevance,meta.root_human_relevance,meta.modifier_human_relevance,meta.gpt-4o_emergence,meta.combination_gpt-4o_relevance,meta.root_gpt-4o_relevance,meta.modifier_gpt-4o_relevance,meta.toxicity,meta.gpt-4o_indiv_max
"He said the world was as wicked as a sick dream, and my heart grew cold in the sunshine.",a sick dream,dream,sick,disturb,emergent,"(emergent, emergent, emergent)","(4, 5, 5)","(3, 3, 3)","(4, 5, 4)",0.4444444444444445,0.7777777777777778,0.3333333333333333,0.3333333333333333,False,0.3333333333333333
More like a kick to the nuts and then pile on more work while telling you you're lucky to have a job at all.,a kick to the nuts,kick,nut,humiliating,emergent,"(emergent, emergent, emergent)","(5, 5, 5)","(4, 3, 2)","(2, 2, 2)",0.4444444444444445,0.7777777777777778,0.3333333333333333,0.0,True,0.3333333333333333
Such a sentiment in the mouth of Mr. Buchanan would have been as unnatural as a voice from the dead.,a voice from the dead,voice,dead,unnatural,emergent,"(emergent, emergent, emergent)","(5, 5, 5)","(2, 3, 2)","(5, 4, 4)",0.5555555555555556,0.8888888888888888,0.3333333333333333,0.0,False,0.3333333333333333
,a trained chimp,chimp,train,lack of sophistication,emergent,"(emergent, emergent, emergent)","(4, 4, 3)","(2, 3, 4)","(3, 2, 2)",0.0,0.3333333333333333,0.5555555555555556,0.2222222222222222,False,0.5555555555555556
"christina was nice enough , but her brain often seemed about as functional as a cardboard lifeboat .",a cardboard lifeboat,lifeboat,cardboard,impractical,emergent,"(emergent, emergent, emergent)","(5, 5, 5)","(3, 2, 2)","(5, 5, 5)",0.6666666666666667,1.0,0.1111111111111111,0.3333333333333333,False,0.3333333333333333
"So even if you could disolve enough into the beer to make bubbles you can't, it would still taste exactly like flat beer.",flat beer,beer,flat,undesirable,emergent,"(emergent, emergent, emergent)","(5, 5, 5)","(4, 2, 2)","(4, 4, 4)",0.5555555555555556,0.8888888888888888,0.2222222222222222,0.3333333333333333,False,0.3333333333333333
"yright like , berry says , as he watches the two girls walk away , fiona coopers arse like a sack of spuds .",a sack of spuds,sack,spud,unattractive,emergent,"(emergent, component, emergent)","(3, 3, 3)","(2, 2, 2)","(3, 3, 2)",0.2222222222222222,0.7777777777777778,0.5555555555555556,0.3333333333333333,False,0.5555555555555556
gthealthy patriotism somehow healthy patriotism sounds always like healthy cancer.,healthy cancer,cancer,healthy,contradictory,emergent,"(emergent, emergent, emergent)","(5, 5, 5)","(2, 3, 3)","(3, 3, 4)",0.6666666666666667,1.0,0.3333333333333333,0.0,False,0.3333333333333333
"Despite myself, I feel myself shiver like a wet mouse. ",a wet mouse,mouse,wet,shivering,emergent,"(emergent, emergent, component)","(5, 5, 5)","(2, 4, 3)","(4, 4, 5)",0.4444444444444445,0.7777777777777778,0.3333333333333333,0.3333333333333333,False,0.3333333333333333
"if he pulled just right and released quickly , he could launch a thieving crow skyward like a stone from a slingshot .",a stone from a slingshot,stone,slingshot,fast,emergent,"(emergent, emergent, emergent)","(5, 5, 5)","(2, 2, 2)","(5, 4, 5)",0.4444444444444445,0.7777777777777778,0.0,0.3333333333333333,False,0.3333333333333333
"i always have to wear it when i 'm being smothered under meaningless words , standing there upright like a carved image .",a carved image,image,carve,unchanging,emergent,"(component, emergent, emergent)","(5, 1, 5)","(4, 4, 2)","(4, 1, 3)",0.4444444444444445,0.7777777777777778,0.3333333333333333,0.1111111111111111,False,0.3333333333333333
It was as if overnight everyone stopped seeing him as a role model and he was unceremoniously tossed away like a used condom.,a used condom,condom,use,worthless,emergent,"(emergent, emergent, emergent)","(5, 5, 4)","(2, 2, 2)","(3, 3, 3)",0.8888888888888888,0.8888888888888888,0.0,0.0,False,0.0
"Turns out the pedicure salon is actually a dingy hole in the wall, kind of like a dive bar.",a dive bar,bar,dive,low,emergent,"(component, emergent, emergent)","(5, 3, 5)","(2, 2, 2)","(4, 1, 5)",0.3333333333333333,0.6666666666666666,0.3333333333333333,0.3333333333333333,False,0.3333333333333333
"My drunk tunnel vision would still cause me to piss into it and then promptly slip in it, so its just as bad as a hole in the floor.",a hole in the floor,hole,floor,dangerous,emergent,"(emergent, emergent, emergent)","(5, 5, 4)","(4, 4, 1)","(2, 2, 1)",0.4444444444444445,0.7777777777777778,0.3333333333333333,0.1111111111111111,False,0.3333333333333333
I bet that even when she removes them every night before she goes to bed she probably looks as plain as burnt toast.,burnt toast,toast,burn,bitter,emergent,"(emergent, emergent, emergent)","(5, 4, 5)","(2, 1, 2)","(5, 1, 4)",0.7777777777777777,0.8888888888888888,0.1111111111111111,0.0,False,0.1111111111111111
But then again the lions also found carrying a damn tree branch around like a dead antelope was good fun too.,a dead antelope,antelope,dead,difficult to carry,emergent,"(component, emergent, emergent)","(5, 5, 5)","(3, 3, 3)","(4, 4, 4)",0.0,0.3333333333333333,0.5555555555555556,0.3333333333333333,False,0.5555555555555556
But a gooid word throo some is as scarce as a white crow.,a white crow,crow,white,uncommon,emergent,"(emergent, emergent, emergent)","(5, 5, 5)","(4, 3, 2)","(4, 3, 4)",0.5555555555555556,0.8888888888888888,0.2222222222222222,0.3333333333333333,False,0.3333333333333333
"The thwarted supernatural lover nereid, fairy, elf, or troll taking this form of revenge is a common motif the tales are generally a variant on Beauty and the Beast, where the victim must live in that form until finding another love, as beautiful as the thwarted lover.",the thwarted lover,lover,thwart,unrequited,emergent,"(emergent, emergent, emergent)","(4, 5, 5)","(2, 4, 4)","(1, 4, 5)",0.5555555555555556,0.8888888888888888,0.3333333333333333,0.0,False,0.3333333333333333
"It is, however, much more populous than southern Palestine, and is extensively cultivated, though at this time of year the crops had all been gathered, and the land was as bare as a village common.",a village common,village,common,uncultivate,emergent,"(emergent, emergent, component)","(4, 5, 3)","(2, 2, 2)","(3, 4, 4)",0.33333333333333337,0.5555555555555556,0.2222222222222222,0.2222222222222222,False,0.2222222222222222
"Indeed, Man, assuming that his nature is as uncontrollable as the course of the stars, has limited his research into the substance of freedom to a groping for an understanding of the adequate external conditions of liberty.",the course of the stars,course,star,unchangeable,emergent,"(emergent, component, emergent)","(5, 4, 4)","(3, 3, 4)","(4, 3, 4)",0.5555555555555556,0.8888888888888888,0.2222222222222222,0.3333333333333333,False,0.3333333333333333
Such numbers continue to be in use and can be transferred between operators just like longer numbers.,longer numbers,number,long,great,emergent,"(2, emergent, emergent)","(3, 3, 5)","(2, 2, 3)","(2, 2, 3)",0.0,0.0,0.0,0.3333333333333333,False,0.3333333333333333
"Any morality, then, built on the sentiments is as unsubstantial as castles in the air, and as unreal as the baseless fabric of a vision.",castles in the air,castle,air,illusory,emergent,"(emergent, emergent, emergent)","(5, 5, 5)","(2, 2, 2)","(4, 3, 3)",1.0,1.0,0.0,0.0,False,0.0
I do like how this dig at nerds implicitly acknowledges that their religions are equally as real as star wars and just hope you wont notice.,star wars,war,star,fictional,emergent,"(emergent, emergent, emergent)","(5, 5, 5)","(1, 1, 2)","(2, 1, 3)",1.0,1.0,0.0,0.0,False,0.0
"With the help of the girls he used to fasten a fat little thing, about twelve months old, in the bend at the middle of the handle, and there like a ham on the steelyard hung this baby and enjoyed seesaw, and laughed at its own utility.",a ham on the steelyard,ham,steelyard,incongruous,emergent,"(emergent, emergent, emergent)","(5, 4, 5)","(3, 1, 3)","(2, 1, 4)",0.5555555555555556,0.7777777777777778,0.1111111111111111,0.2222222222222222,False,0.2222222222222222
"When Lesable set out for his office, she called from her room Do not forget your umbrella or you will come back as muddy as an omnibus wheel.",an omnibus wheel,wheel,omnibus,grimy,emergent,"(emergent, emergent, component)","(4, 4, 3)","(3, 4, 3)","(2, 5, 2)",0.22222222222222227,0.5555555555555556,0.3333333333333333,0.3333333333333333,False,0.3333333333333333
"My looks don't tell the truth, said I, not wishing to speak of myself I am up and down like a barometer in the tropics.",a barometer in the tropics,barometer,tropic,up and down,emergent,"(emergent, emergent, component)","(5, 5, 5)","(5, 4, 5)","(1, 3, 1)",0.0,0.3333333333333333,0.7777777777777778,0.0,False,0.7777777777777778
"These impressive attributes however were not very necessary when talking to the general, his emotional responses were about as subtle as a truck to the face.",a truck to the face,truck,face,jarring,emergent,"(emergent, emergent, emergent)","(5, 5, 5)","(3, 4, 3)","(2, 3, 3)",0.6666666666666667,1.0,0.3333333333333333,0.3333333333333333,False,0.3333333333333333
"Those guys know very well the dangers of getting the shit beat out of them, not that the NFL players don't, tackles and repeated small hits aren't as explicit as a head kick.",a head kick,kick,head,dangerous,emergent,"(emergent, component, emergent)","(5, 5, 5)","(4, 4, 3)","(3, 3, 4)",0.4444444444444445,0.7777777777777778,0.3333333333333333,0.1111111111111111,False,0.3333333333333333
"So she could not bear the taunting word, sir and when it came, unexpectedly to us, she fled away like a hunted deer, through yonder door, till her poor strength gave out, and then we found her and the babe just like dead.",a hunted deer,deer,hunt,helpless,emergent,"(emergent, emergent, component)","(5, 5, 3)","(2, 3, 1)","(4, 4, 3)",0.2222222222222222,0.7777777777777778,0.5555555555555556,0.0,False,0.5555555555555556
People can change in the echo of a moment or the as quickly as the catching of a spark.,the catching of a spark,catching,spark,quick,emergent,"(emergent, emergent, emergent)","(5, 5, 5)","(4, 4, 4)","(4, 5, 5)",0.11111111111111116,1.0,0.5555555555555556,0.8888888888888888,False,0.8888888888888888
You and I were always like apples and oranges I dont understand why youre still buying oranges.,apples and oranges,apple,orange,contrast,emergent,"(emergent, emergent, emergent)","(5, 5, 5)","(2, 2, 2)","(2, 2, 2)",0.4444444444444445,0.7777777777777778,0.3333333333333333,0.3333333333333333,False,0.3333333333333333
And was it really kind of like a stab in the dark because you don't have any medical records?,a stab in the dark,stab,dark,speculative,emergent,"(emergent, emergent, emergent)","(5, 5, 5)","(2, 1, 2)","(3, 1, 3)",0.6666666666666667,1.0,0.0,0.3333333333333333,False,0.3333333333333333
"Still though, it was so frustrating to have him sit there like a wounded child, he never listened, that was always the problem, so absorbed in his own petty little...",a wounded child,child,wound,helpless,emergent,"(component, emergent, emergent)","(5, 4, 5)","(4, 2, 4)","(4, 2, 4)",0.2222222222222222,0.7777777777777778,0.5555555555555556,0.3333333333333333,False,0.5555555555555556
Pizza on pineapple is as delicious as pineapple on pizza IT'S GREAT Pepperoni on a pizza is just fucking awful.,pineapple on pizza,pineapple,pizza,contentious,emergent,"(emergent, emergent, emergent)","(5, 5, 5)","(3, 2, 3)","(4, 2, 3)",0.5555555555555556,0.8888888888888888,0.3333333333333333,0.3333333333333333,False,0.3333333333333333
Power without perspective is as crippling as perspective without power.,perspective without power,perspective,power,lacking control,emergent,"(emergent, emergent, emergent)","(5, 5, 5)","(2, 3, 3)","(4, 5, 5)",0.5555555555555556,0.8888888888888888,0.3333333333333333,0.1111111111111111,False,0.3333333333333333
"Acquiring experience from disappointment, and deeming that the wonder of his person might be as insupportable as excess of light, the rial purposed to let himself in upon the public by degrees.",excess of light,excess,light,blind,emergent,"(emergent, emergent, emergent)","(5, 5, 5)","(3, 3, 3)","(4, 5, 4)",0.2222222222222222,0.7777777777777778,0.5555555555555556,0.3333333333333333,False,0.5555555555555556
"Our happiness is about as relevant as the happiness of cattle in a factory farm, so long as we keep spending the money they grudgingly give us.",the happiness of cattle,happiness,cattle,meaningless,emergent,"(2, emergent, emergent)","(1, 5, 4)","(1, 4, 2)","(1, 3, 3)",0.2222222222222222,0.3333333333333333,0.0,0.1111111111111111,False,0.1111111111111111
"And now unnamed pilot, his arms went limp, his mouth hung open like a hooked fish, his consciousness flooded out of him and his eyes went dark.",a hooked fish,fish,hooked,helpless,emergent,"(emergent, emergent, emergent)","(5, 5, 5)","(4, 2, 4)","(3, 4, 3)",0.33333333333333326,0.8888888888888888,0.3333333333333333,0.5555555555555556,False,0.5555555555555556
"Each player is dealt one card that they display to all other players traditionally stuck to the forehead facing outwards, supposedly like an Indian feather.",an Indian feather,feather,indian,symbolic,emergent,"(emergent, emergent, component)","(5, 4, 5)","(3, 1, 3)","(5, 1, 4)",0.2222222222222222,0.7777777777777778,0.3333333333333333,0.5555555555555556,False,0.5555555555555556
The houses on either side shot past like pictures in the kinetoscope.,pictures in the kinetoscope,picture,kinetoscope,fleeting,emergent,"(emergent, emergent, emergent)","(5, 4, 5)","(2, 1, 2)","(4, 1, 4)",0.4444444444444445,0.7777777777777778,0.3333333333333333,0.3333333333333333,False,0.3333333333333333
"Yeah, kind of like oil and beer.",oil and beer,oil,beer,incompatible,emergent,"(emergent, emergent, emergent)","(5, 4, 5)","(1, 3, 2)","(1, 2, 2)",0.5555555555555556,0.7777777777777778,0.2222222222222222,0.0,False,0.2222222222222222
"s oddly formal bearing, was rather like a cold douche.",a cold douche,douche,cold,surprising,emergent,"(emergent, emergent, emergent)","(4, 5, 5)","(2, 2, 2)","(3, 4, 3)",0.5555555555555556,0.7777777777777778,0.2222222222222222,0.2222222222222222,False,0.2222222222222222
"Lady Romaine waved her scented kerchief, and then routed her scentbottle out of her reticule, and turning sharply upon her daughter, said, Why sit you ever like a stuffed owl, without so much as a word or a smile?",a stuffed owl,owl,stuff,unresponsive,emergent,"(component, emergent, emergent)","(5, 5, 5)","(2, 2, 3)","(3, 5, 3)",0.6666666666666667,1.0,0.2222222222222222,0.3333333333333333,False,0.3333333333333333
"In comparison with Central Park, where one is so aggressively overguarded by men with whistles, in spite of which the place is littered with paper, this park is as neat as a private garden.",a private garden,garden,private,well,emergent,"(emergent, 2, emergent)","(3, 2, 2)","(3, 3, 2)","(2, 2, 1)",0.0,0.3333333333333333,0.3333333333333333,0.3333333333333333,False,0.3333333333333333
"You can basically flop on top of him, or jiggle his belly as roughly as I want, and he just is purring the whole time, looking completely relaxed, and when i finally let him go, he makes no move to leave, he just lays there like a fat blob, then he'll look up at me like What'd you stop for?",a fat blob,blob,fat,unmove,emergent,"(emergent, emergent, component)","(4, 4, 4)","(3, 3, 3)","(2, 4, 2)",0.22222222222222227,0.5555555555555556,0.3333333333333333,0.3333333333333333,False,0.3333333333333333
"The alert French waiter shot away like a stone from a catapult, leaving Coventry to lapse back into the reverie from which he had roused himself to order his coffee.",a stone from a catapult,stone,catapult,swift,emergent,"(emergent, emergent, emergent)","(4, 5, 4)","(2, 1, 1)","(5, 5, 4)",0.2222222222222222,0.7777777777777778,0.0,0.5555555555555556,False,0.5555555555555556
"Although there is a ban on the sale and advertisement of tobacco products to those who are underage under the age of 18 adolescents have also begun smoking at higher rates, starting as young as thirteen years of age due to a lack of enforcement of this ban.",thirteen years of age,year,age,adolescent,emergent,"(emergent, component, emergent)","(5, 5, 5)","(2, 2, 2)","(4, 4, 4)",0.6666666666666667,1.0,0.0,0.3333333333333333,False,0.3333333333333333
"His eyes were like a serpent's in their steadiness, and the muscles of his body were drawn as tight as steel springs, ready to loose themselves when the chance came.","steel springs,",spring,steel,tense,emergent,"(emergent, component, emergent)","(5, 5, 5)","(3, 4, 4)","(2, 3, 2)",0.4444444444444445,0.7777777777777778,0.3333333333333333,0.3333333333333333,False,0.3333333333333333
My thought was borne farther and farther like a leaf in a tempest....,a leaf in a tempest,leaf,temp,vulnerable,emergent,"(emergent, emergent, emergent)","(5, 5, 4)","(4, 2, 4)","(5, 3, 2)",0.5555555555555556,0.8888888888888888,0.3333333333333333,0.3333333333333333,False,0.3333333333333333
It is just like the girls in books!,the girls in books,girl,book,idealize,emergent,"(emergent, emergent, emergent)","(3, 5, 4)","(1, 3, 3)","(1, 3, 3)",0.0,0.3333333333333333,0.3333333333333333,0.3333333333333333,False,0.3333333333333333
"And he thumps the ground just like a horse stamping, said Rose.",a horse stamping,horse,stamp,loud,emergent,"(emergent, emergent, component)","(5, 5, 5)","(2, 2, 2)","(4, 4, 4)",0.4444444444444445,0.7777777777777778,0.3333333333333333,0.0,False,0.3333333333333333
"before it, though they once covered the land, they have melted away like snow beneath the sun.  ",snow beneath the sun,snow,sun,melted,emergent,"(emergent, component, emergent)","(5, 5, 5)","(4, 3, 4)","(5, 5, 5)",0.5555555555555556,0.8888888888888888,0.3333333333333333,0.0,False,0.3333333333333333
Just the perception of a conflict of interest can be as bad as a conflict of interest.,a conflict of interest,conflict,interest,unethical,emergent,"(emergent, emergent, emergent)","(5, 5, 5)","(2, 3, 3)","(1, 2, 2)",0.5555555555555556,0.8888888888888888,0.3333333333333333,0.2222222222222222,False,0.3333333333333333
"They are the aborigines of the islands in this part of the world, and are as primitive as the Australian blacks, having no social or political organization but that of the family.",the Australian blacks,black,australian,aboriginous,emergent,"(emergent, component, emergent)","(5, 5, 5)","(1, 3, 2)","(4, 4, 4)",0.6666666666666667,1.0,0.3333333333333333,0.3333333333333333,False,0.3333333333333333
"Tasted exactly like bacon and vodka at the same time, but its just wrong like those popcorn jellybeans.",bacon and vodka,bacon,vodka,unusual,emergent,"(emergent, emergent, emergent)","(5, 5, 5)","(2, 1, 3)","(2, 1, 3)",0.5555555555555556,0.7777777777777778,0.2222222222222222,0.1111111111111111,False,0.2222222222222222
"her last words echo in my head , swirling around like water down a drain .",water down a drain,water,drain,fleeting,emergent,"(emergent, emergent, emergent)","(5, 5, 5)","(2, 3, 3)","(1, 4, 4)",0.6666666666666667,1.0,0.2222222222222222,0.3333333333333333,False,0.3333333333333333
It's sort of like a knife in the back.,a knife in the back,knife,back,betray,emergent,"(emergent, emergent, emergent)","(5, 5, 5)","(2, 3, 3)","(4, 5, 4)",0.5555555555555556,0.8888888888888888,0.1111111111111111,0.3333333333333333,False,0.3333333333333333
"just like war of worlds , injected bates .",war of worlds,war,world,imaginary,emergent,"(emergent, emergent, emergent)","(5, 3, 5)","(1, 1, 2)","(1, 1, 2)",1.0,1.0,0.0,0.0,False,0.0
"He was staggering in ragged rings, his mouth gnashing at the bar, moving slower and slower like a machine running down.",a machine running down,machine,run,malfunction,emergent,"(emergent, emergent, component)","(5, 5, 5)","(4, 4, 4)","(3, 3, 3)",0.4444444444444445,0.7777777777777778,0.3333333333333333,0.0,False,0.3333333333333333
I was as lively as a dog with wings.,a dog with wings,dog,wing,fantastical,emergent,"(emergent, emergent, emergent)","(5, 5, 5)","(2, 2, 3)","(4, 4, 4)",0.7777777777777778,1.0,0.0,0.2222222222222222,False,0.2222222222222222
Although at some point these tiny odds are just thrown out and considered random like the flip of a coin.,the flip of a coin,flip,coin,random,emergent,"(component, emergent, emergent)","(5, 5, 5)","(4, 2, 3)","(4, 1, 4)",0.4444444444444444,1.0,0.3333333333333333,0.5555555555555556,False,0.5555555555555556
They're packed together like sardines in one area.,sardines in one area,sardine,area,crowd,emergent,"(emergent, component, emergent)","(5, 5, 5)","(4, 3, 3)","(2, 5, 2)",0.4444444444444444,1.0,0.5555555555555556,0.3333333333333333,False,0.5555555555555556
"I mean, they go together like a horse and buggy.",a horse and buggy,horse,buggy,old,emergent,"(emergent, component, emergent)","(5, 5, 5)","(2, 3, 2)","(3, 4, 4)",0.5555555555555556,0.8888888888888888,0.3333333333333333,0.3333333333333333,False,0.3333333333333333
It is kind of like sports journalism in that it talks about when you get a stock market expert on television generally his area of expertise is the past.,sports journalism,journalism,sport,specialize,emergent,"(emergent, emergent, emergent)","(5, 5, 5)","(3, 4, 4)","(4, 3, 3)",0.22222222222222227,0.5555555555555556,0.3333333333333333,0.3333333333333333,False,0.3333333333333333
"It made a noise almost like the noise of a hammer, said Paul Solange.",the noise of a hammer,noise,hammer,distinct,emergent,"(emergent, emergent, emergent)","(5, 4, 4)","(3, 3, 3)","(4, 3, 2)",0.4444444444444445,0.7777777777777778,0.3333333333333333,0.3333333333333333,False,0.3333333333333333
You are as observant as a pig in muck.,a pig in muck,pig,muck,content,emergent,"(emergent, emergent, emergent)","(4, 4, 3)","(2, 2, 2)","(3, 3, 2)",0.33333333333333326,0.8888888888888888,0.5555555555555556,0.0,False,0.5555555555555556
,a ashtray on a motorbike,ashtray,motorbike,completely impractical,emergent,"(emergent, emergent, emergent)","(5, 5, 5)","(4, 4, 3)","(3, 5, 2)",0.6666666666666667,1.0,0.2222222222222222,0.3333333333333333,False,0.3333333333333333
"she might be sleeping with a merimon brother , but he was as different as night from day from gray .",night from day,night,day,dissimilar,emergent,"(emergent, emergent, emergent)","(5, 5, 5)","(3, 1, 5)","(3, 1, 5)",0.6666666666666667,1.0,0.3333333333333333,0.0,False,0.3333333333333333
The screens of our wordmachines glow as serenely as illuminated manuscripts .,illuminated manuscripts,manuscript,illuminate,ornate,emergent,"(emergent, emergent, component)","(5, 5, 5)","(3, 3, 3)","(4, 4, 4)",0.6666666666666667,1.0,0.3333333333333333,0.3333333333333333,False,0.3333333333333333
"He's as solemn as a stuffed owl, and he'llWell, I'm goin' to put MY oar in.","a stuffed owl,",owl,stuff,lifeless,emergent,"(emergent, emergent, emergent)","(5, 5, 4)","(1, 2, 1)","(4, 4, 3)",0.6666666666666667,1.0,0.0,0.3333333333333333,False,0.3333333333333333
,a kite but one without a string,kite,string,uncontrolled,emergent,"(emergent, emergent, emergent)","(5, 5, 5)","(3, 3, 3)","(3, 2, 5)",0.5555555555555556,0.8888888888888888,0.3333333333333333,0.1111111111111111,False,0.3333333333333333
"Nay, I lie as still as a cat in a gutter.",a cat in a gutter,cat,gutter,vulnerable,emergent,"(emergent, emergent, emergent)","(4, 5, 5)","(1, 3, 2)","(1, 4, 1)",0.3333333333333333,0.6666666666666666,0.3333333333333333,0.3333333333333333,False,0.3333333333333333
"The margin is wavy like the edge of a scallop, and may appear ragged because of lingering remnants of the partial veil.",the edge of a scallop,edge,scallop,irregular,emergent,"(emergent, component, emergent)","(5, 5, 5)","(3, 3, 3)","(4, 4, 4)",0.33333333333333326,0.8888888888888888,0.3333333333333333,0.5555555555555556,True,0.5555555555555556
open like a bad ventriloquist ?,a bad ventriloquist,ventriloquist,bad,unconvincing,emergent,"(component, emergent, emergent)","(5, 5, 5)","(2, 3, 3)","(4, 4, 4)",0.5555555555555556,0.8888888888888888,0.3333333333333333,0.3333333333333333,False,0.3333333333333333
Mitazono took office on 28 July 2016 and stated at a press conference on his first day that he would seek the suspension of operation at the Sendai Nuclear Power Plant as early as the following month.,the following month,month,follow,upcoming,emergent,"(emergent, component, emergent)","(5, 5, 5)","(3, 3, 3)","(4, 4, 4)",0.4444444444444444,1.0,0.3333333333333333,0.5555555555555556,False,0.5555555555555556
You'll wind up flopping your hand back and forth like a fish on land.,a fish on land,fish,land,awkward,emergent,"(emergent, emergent, emergent)","(5, 5, 5)","(2, 3, 2)","(3, 4, 3)",0.6666666666666666,0.8888888888888888,0.2222222222222222,0.0,False,0.2222222222222222
"Although Canning wrote that the newspaper delivered on the laughs, Entertainment Weekly Sandra Gonzalez characterized the newspaper subplot was neither important nor substantive and was unimpressed with the random, frightening costume changes, and Reiter said Sue's storyline was one that felt as tired as secondhand news.",secondhand news,news,secondhand,stale,emergent,"(component, emergent, emergent)","(5, 5, 5)","(2, 3, 2)","(4, 5, 3)",0.3333333333333333,0.6666666666666666,0.2222222222222222,0.3333333333333333,False,0.3333333333333333
,an honest politician,politician,honest,rare,emergent,"(emergent, component, emergent)","(5, 4, 5)","(3, 2, 4)","(4, 4, 4)",0.11111111111111116,0.7777777777777778,0.2222222222222222,0.6666666666666666,False,0.6666666666666666
"Mr. Stratton, don't you think?exactly like a little shepherdess.",a little shepherdess,shepherdess,little,naive,emergent,"(emergent, emergent, emergent)","(3, 3, 4)","(2, 4, 3)","(2, 2, 3)",0.3333333333333333,0.6666666666666666,0.3333333333333333,0.3333333333333333,False,0.3333333333333333
